,,,,,,,
EXONERACIONES ESTUDIOS INTERNACIONALES USM 2024-2025 ,,,,,,,
No.,Apellidos,Nombres,Cedula,Semestre,Universidad/TSU,Fecha del Servicio Comunitario,Titulo
1,MORENO LA CRUZ.,ASHLEY SUSANA.,29.511.024.,10mo. SEMESTRE,INSTITUTO UNIVERSITARIO DE PROFESIONES GERENCIALES,Año 2023,TSU EN GERENCIA FINANCIERA.
2,ESPINOZA ALVAREZ.,WILFRAINNER JELIHER.,27.103.121.,7mo. SEMESTRE.,COLEGIO UNIVERSITARIO DE ADMINISTRACION Y MERCADEO.,Año 2021,TSU EN ADMINISTRACION DE ADUANAS.
3,LARA CAVANZO,LAURA LUCÍA,28.142.921,8vo. SEMESTRE,UNIVERSIDAD POLITÉCNICA TERRITORIAL DEL ESTADO MÉRIDA,Año 2024,LICENCIADA EN DESARROLLO ENDÓGENO. SUB ÁREA: EMERGENCIAS PREHOSPITALARIA
4,ÁLVAREZ GONZALEZ ,KAROL NISLEIVY ,28.469.710,9no. SEMESTRE,ESCUELA NACIONAL DE ADMINISTRACIÓN Y HACIENDA PÚBLICA ,Año 2024,NO POSEE TÍTULO PROFESIONAL 
5,APONTE CONTRERAS ,VERÓNICA SOPHIA,27.020.537,10mo. SEMESTRE,UNIVERSIDAD SANTA MARIA,2024,ABOGADO
6,,,,,,,